{
 "$schema": "../../../schema/dataset.schema.json",
 "schemaVersion": 1,
 "franchise": {
  "key": "mixed",
  "wordmark": "Mixed Line",
  "title": "Mixed Line — Reading Order",
  "strapline": "harness fixture · comics, a show and two games",
  "span": "1990–1992",
  "theme": "#2A2F3A",
  "background": "#F2EFE8",
  "strictCredits": true
 },
 "periods": [
  { "id": "early", "name": "Early Days", "label": "1990–1991", "eras": ["one", "two"] },
  { "id": "late", "name": "Late Days", "label": "1992", "eras": ["three"] }
 ],
 "eras": [
  { "id": "one", "name": "One", "rank": 5000, "years": "1990" },
  { "id": "two", "name": "Two", "rank": 5010, "years": "1991" },
  { "id": "three", "name": "Three", "rank": 5020, "years": "1992" }
 ],
 "strands": ["Main"],
 "types": ["MAIN", "GAME", "SHOW"],
 "tiers": ["Essential", "Everything"],
 "media": ["comic", "game", "screen"],
 "durations": { "screen": 22 },
 "arcs": [
  { "id": "opening", "name": "Opening", "era": "one", "strands": ["Main"], "type": "MAIN", "mo": "M", "tier": "Essential",
    "credits": { "writers": ["Avery Quill"], "artists": ["Cass Delune"] } },
  { "id": "the-game", "name": "The Game", "era": "one", "strands": ["Main"], "type": "GAME", "mo": "O", "tier": "Everything",
    "credits": { "writers": ["Bram Ostrow"], "artists": ["Dorian Vale"] } },
  { "id": "the-show", "name": "The Show", "era": "two", "strands": ["Main"], "type": "SHOW", "mo": "O", "tier": "Everything",
    "credits": { "writers": ["Emeka Stroud"], "artists": ["Fen Larkspur"] } },
  { "id": "middle", "name": "Middle", "era": "two", "strands": ["Main"], "type": "MAIN", "mo": "M", "tier": "Essential",
    "credits": { "writers": ["Avery Quill"], "artists": ["Cass Delune"] } },
  { "id": "finale", "name": "Finale", "era": "three", "strands": ["Main"], "type": "MAIN", "mo": "M", "tier": "Essential",
    "credits": { "writers": ["Avery Quill"], "artists": ["Cass Delune"] } },
  { "id": "sequel-game", "name": "Sequel Game", "era": "three", "strands": ["Main"], "type": "GAME", "mo": "O", "tier": "Everything",
    "credits": { "writers": ["Bram Ostrow"], "artists": ["Dorian Vale"] } },
  { "id": "elsewhere", "name": "Elsewhere", "era": "three", "strands": ["Main"], "type": "MAIN", "mo": "O", "tier": "Everything",
    "credits": { "writers": ["Emeka Stroud"], "artists": ["Fen Larkspur"] } }
 ],
 "rows": [
  { "issueId": "mixed-hero-1990-1", "series": "Mixed Hero", "vol": "1990", "num": "1", "title": "Mixed Hero (1990) #1",
    "era": "one", "arc": "opening", "date": { "cover": "1990-01", "source": "fixture ledger (invented)" } },
  { "issueId": "mixed-hero-1990-2", "series": "Mixed Hero", "vol": "1990", "num": "2", "title": "Mixed Hero (1990) #2",
    "era": "one", "arc": "opening", "date": { "cover": "1990-02", "source": "fixture ledger (invented)" } },
  { "issueId": "mixed-quest-1990", "series": "Mixed Quest", "vol": "1990", "title": "Mixed Quest (1990)",
    "era": "one", "arc": "the-game", "medium": "game", "duration": 1500,
    "date": { "cover": "1990-03", "source": "fixture ledger (invented)" } },
  { "issueId": "mixed-hero-1990-3", "series": "Mixed Hero", "vol": "1990", "num": "3", "title": "Mixed Hero (1990) #3",
    "era": "one", "arc": "opening", "date": { "cover": "1990-04", "source": "fixture ledger (invented)" } },
  { "issueId": "mixed-toons-1991-s1e1", "series": "Mixed Toons", "vol": "1991", "num": "S1E1", "title": "Mixed Toons (1991) S1E1",
    "era": "two", "arc": "the-show", "medium": "screen", "date": { "cover": "1991-01", "source": "fixture ledger (invented)" } },
  { "issueId": "mixed-toons-1991-s1e2", "series": "Mixed Toons", "vol": "1991", "num": "S1E2", "title": "Mixed Toons (1991) S1E2",
    "era": "two", "arc": "the-show", "medium": "screen", "date": { "cover": "1991-02", "source": "fixture ledger (invented)" } },
  { "issueId": "mixed-toons-1991-s1e3", "series": "Mixed Toons", "vol": "1991", "num": "S1E3", "title": "Mixed Toons (1991) S1E3",
    "era": "two", "arc": "the-show", "medium": "screen", "duration": 44, "note": "Double-length finale.",
    "date": { "cover": "1991-03", "source": "fixture ledger (invented)" } },
  { "id": "gap-middle", "title": "Gap: the team splits up off-panel", "era": "two", "arc": "middle", "flags": ["GAPNOTE"],
    "date": { "cover": "1991-04" } },
  { "issueId": "mixed-hero-1990-4", "series": "Mixed Hero", "vol": "1990", "num": "4", "title": "Mixed Hero (1990) #4",
    "era": "two", "arc": "middle", "date": { "cover": "1991-04", "source": "fixture ledger (invented)" } },
  { "issueId": "mixed-hero-1990-5", "series": "Mixed Hero", "vol": "1990", "num": "5", "title": "Mixed Hero (1990) #5",
    "era": "two", "arc": "middle", "date": { "cover": "1991-05", "source": "fixture ledger (invented)" } },
  { "issueId": "mixed-hero-1990-6", "series": "Mixed Hero", "vol": "1990", "num": "6", "title": "Mixed Hero (1990) #6",
    "era": "three", "arc": "finale", "date": { "cover": "1992-01", "source": "fixture ledger (invented)" } },
  { "issueId": "mixed-quest-ii-1992", "series": "Mixed Quest II", "vol": "1992", "title": "Mixed Quest II (1992)",
    "era": "three", "arc": "sequel-game", "medium": "game", "note": "Length not yet researched.",
    "date": { "cover": "1992-02", "source": "fixture ledger (invented)" } },
  { "issueId": "mixed-hero-1990-7", "series": "Mixed Hero", "vol": "1990", "num": "7", "title": "Mixed Hero (1990) #7",
    "era": "three", "arc": "finale", "date": { "cover": "1992-03", "source": "fixture ledger (invented)" } },
  { "issueId": "mixed-elsewhere-1992-1", "series": "Mixed Elsewhere", "vol": "1992", "num": "1", "title": "Mixed Elsewhere (1992) #1",
    "era": "three", "arc": "elsewhere", "flags": ["ALT"], "note": "A separate continuity.",
    "date": { "cover": "1992-04", "source": "fixture ledger (invented)" } }
 ],
 "legend": [{ "term": "★ core", "meaning": "Barebones path" }],
 "maintenance": ["Harness fixture: one row per duration case."]
}
